app_id,app_name,app_package_name,app_category,number_of_downloads,privacy_policy_url,standard,reason
22,ZoneIn,com.zonein,Health & Fitness,1K+,https://www.getzonein.com/privacy-policy,Good Standard,"| Good |
The privacy policy is thorough and well outlined, covering key areas necessary for Good Standard Assessment:
- Lawfulness, Fairness, and Transparency: The policy provides clear language that outlines its practices. It emphasizes transparency about data collection and usage. (e.g., the sections 'WHAT INFORMATION DO WE COLLECT?' and 'HOW DO WE USE YOUR INFORMATION?'). The policy states the legal bases for processing user data.
- Purpose Limitation: The policy explains in detail how it uses the information collected. It lists legitimate business interests, legal obligations, user consent, and contract fulfillment as reasons for data usage.
- Data Minimization: The policy details the specific types of data being collected and processed and their necessity to the service.
- Accuracy: The policy allows users to review, update, or delete their personal data, ensuring accuracy of data (e.g., section '12. HOW CAN YOU REVIEW, UPDATE, OR DELETE THE DATA WE COLLECT FROM YOU?').
- Storage Limitation: The policy specifies the retention period of the personal data and outlines the procedures for data deletion or anonymization when necessary.
- Integrity and Confidentiality: The policy describes the measures taken to keep user data secure (e.g., '6. HOW DO WE KEEP YOUR INFORMATION SAFE?').
One point of consideration, however, the policy claims not to respond to ""Do Not Track"" preferences set on the user's browser. This may fall short in being fully transparent about their tracking technologies."
23,Elevate Parcel,com.tdn.elevate,Productivity,50K+,http://39dn.com/widgets/privacy/,Bad Standard,"| Bad | While the policy is transparent and outlines lawful and fair means of data collection, it does not explicitly define the purpose for data collection or how long it will retain the data. It also doesn't provide mechanisms for users to update or correct their data, or criteria for data retention periods."
24,onX Hunt: GPS Hunting Maps,onxmaps.hunt,Sports,5M+,https://www.onxmaps.com/privacy-policy,Good Standard,"| Good | The privacy policy of onXmaps, Inc. fairly meets the Good Standard Assessment criteria.
- Lawfulness, Fairness, and Transparency: The policy is clear about its legal obligations and explains in detail the purposes and methods of data collection.
- Purpose Limitation: The company clearly states the purposes for data collection using their services. The policy also ensures data is not used for incompatible purposes without extra consent.
- Data Minimization: The policy mentions collection of only necessary data for providing the service.
- Accuracy: The policy allows users to update or correct their data through their customer support email.
- Storage Limitation: The policy mentions that data is retained only as long as necessary, with the potential for anonymization for non-personally identifiable and aggregate information.
- Integrity and Confidentiality: The policy mentions the use of physical and electronic safeguards for data protection. However, there is a lack of specifics on encryption and regular security assessments."
25,Atlas Earth - Buy Virtual Land,ci.atlasearth.client,Finance,1M+,https://legal.atlasreality.com/content/common/privacy-policy.html,Good Standard,"| Good | The privacy policy of Atlas Reality, Inc. seems to adhere well to Good Standard criteria. It transparently outlines the types of personal data it collects, both directly and indirectly, and the purposes for such collection, such as service improvement and marketing efforts, in line with the principle of lawfulness, fairness, and transparency. It also places limitations on data use, stating that it won't be used for purposes other than stated without additional consent from the user, adhering to the principle of purpose limitation. Regarding data minimization, the policy collects only necessary data required for the stated purpose. Accuracy is ensured through user's rights to rectify and update their data. There are clear retention periods defined and storage limitation procedures in place. Lastly, the policy asserts that the company follows industry standards for data security, suggesting adequate measures for integrity and confidentiality. However, it's recommended to provide more specific details about these security measures."
26,The Regrid Property App,com.loveland.pr,Maps & Navigation,100K+,https://regrid.com/terms/privacy,Bad Standard,"| Bad | The policy does not fully align with the Good Standard Assessment as defined by GDPR Article 5. It does not explicitly state its legal basis for data processing, maintaining Lawfulness, Fairness, and Transparency. It is also vague about Purpose Limitation, as the purposes for data collection are not clearly defined. While the policy mentions collecting necessary information for registration, it does not emphasize data minimization effectively. Furthermore, there are no clear measures to ensure data accuracy - users are not provided with a mechanism to update or correct their data. Also, the document doesn't set clear retention periods (Storage Limitation) and there is no explanation about data deletion or anonymization procedures. Finally, the document is silent on Integrity and Confidentiality measure, it does not mention any security measures to protect data."
27,Zonneplan | Energie,com.zonneplanapp,Tools,50K+,https://www.zonneplan.nl/privacy,Bad Standard,"| Bad | The reason is that the policy does not fully meet all the Good Standard criteria. While the policy does indicate that data is only shared with necessary third parties, and that there are precautions for data protection (Lawfulness, Fairness, and Transparency, and Integrity and Confidentiality), it does not explicitly mention users’ rights to update or correct their data for accuracy purposes. The policy also does not define clear data retention periods or the process for data deletion or anonymization (Accuracy, and Storage Limitation). Furthermore, the policy only loosely defines the purpose of data collection, not ensuring that data isn't used for other purposes without additional consent (Purpose Limitation)."
28,My Telenor,com.telenor.pakistan.mytelenor,Tools,10M+,https://www.telenor.com.pk/privacy-notice/,Good Standard,"| Good |
This privacy policy document follows GDPR Article 5 standards of Good Standard Assessment well.
- The company states their commitment to fairness and transparency (Sections 1 & 2)
- The purpose of data collection is clearly outlined (Section 3)
- The data minimization principle is mentioned by stating they collect only necessary data (Section 3)
- Mechanisms for ensuring data accuracy, such as customers' rights to access, rectification, and erasure are in place (Section 8)
- Storage limitations are stated with concrete retention period terms and plans for data disposal (Section 7)
- Integrity and confidentiality are well-maintained via various encryption methods and protocols to protect user data, along with a commitment to data protection by design and by default (Section 6).
However, the company is recommended to make the policy language even simpler and more transparent for users to easily understand."
29,Acres: Land Data & Parcel Maps,com.acretrader.acremapsmobile,Business,100K+,https://www.acres.co/privacy-policy,Good Standard,"| Good | This privacy policy is classified as Good Standard due to several reasons:
1. Lawfulness, Fairness, and Transparency: The policy clearly mentions its lawful basis for data processing and uses simple, transparent language that can be understood easily by the users. Various sections such as ""How we use your personal information"", ""How we share your personal information"", and ""Security practices"" offer a fair insight into their data handling procedures.
2. Purpose Limitation: The policy defines the purposes for data collection in a very detailed manner. They range from providing and improving services to complying with laws and handling fraud prevention.
3. Data Minimization: It specifies the exact information being collected; from user-provided information like contact details and account information to automatically collected data like device data and online activity data.
4. Accuracy: A mechanism for accuracy is established where users who have registered an account with them can review and update certain personal information.
5. Storage Limitation : The policy does not directly mention the data retention periods, however, it establishes that they may process data as necessary for their services, compliance with law, fraud prevention, and business operations.
6. Integrity and Confidentiality: Their ""Security practices"" section establishes their commitment to data security through organizational, technical, and administrative measures. They also mention that data transmitted over the internet cannot be guaranteed secure, which is a standard disclaimer."
30,HAPPY ZONE - Battle Royale,com.prty.hpz,Action+Shooter+Tactical shooter+Casual+Multiplayer+Competitive multiplayerStylized,500K+,https://docs.google.com/document/d/e/2PACX-1vSvHGsS6RfgaotObZKyspmHHzffXL1-dQxEUqGTRhQ7pIBwSO4f-Wjdl7I-jDc3gi4BI17EbwAfP-ZJ/pub,Bad Standard,"| Bad | The privacy policy does not clearly underline data minimization, storage limitations, and accuracy measures. It doesn't specify whether the data collection is limited to what is necessary for the stated purpose of providing the service (Games) and improving them. In addition, there's a lack of detail about how long user data is retained and how the process of deletion or anonymization is implemented after the purpose is fulfilled, as per the GDPR's storage limitation principle. Finally, it does not include mechanisms for users to correct or update their data, violating the accuracy requirement."
31,Locus GIS offline land survey,menion.android.locus.gis,Productivity,500K+,https://help.locusgis.com/en/support/solutions/articles/47001181440-privacy-policy/,Good Standard,"| Good |
The privacy policy is in good standard because:
1. Lawfulness, Fairness, and Transparency: The policy clearly states its legal basis for data processing, which is the GDPR (Regulation of the European Parliament and of the Council (EU) 2016/679). The policy uses transparent language to explain how user data is processed.
2. Purpose Limitation: The policy clearly defines the purposes for data collection, such as to allow users to use the application, maintain its functions, and stay in touch with users. It limits data use to these purposes.
3. Data Minimization: The policy specifies that only necessary data is collected for the user account, location tracking for the app's functionality, and analytical purposes.
4. Accuracy: The policy indicates that users can change their optional data at any time and the data will be updated or deleted as specified.
5. Storage Limitation: The policy outlines specific retention periods for different types of data, such as that necessary for the performance of the License Agreement, and it also specifies a process for data to be deleted after such periods.
6. Integrity and Confidentiality: The policy states that it shares personal data securely with third parties for the purpose of fulfilling its stated purposes and uses secure analytical services from trusted companies such as Google Inc. and Google Ireland Limited."
32,Land Builder,com.game.perfectlands,Casual,1M+,https://say.games/privacy-policy,Good Standard,"| Good | This policy sets a clearly stated legal basis for data processing based on GDPR Article 5. It gives specific details about what data is being collected and why, and explains how long the data will be retained. It also has a transparent process for users to update or delete their data, and provides a way to object to data processing. The policy also mentions using adequate security measures to protect the user's data, including encryption and regular security assessments. The policy also has clear descriptions of users' rights according to GDPR Article 5 and CCPA."
33,Land Map - GPS Land Survey & M,com.globalgnss.landmap,Maps & Navigation,100K+,https://globalgns.com/globalgnss-privacypolicy.html,Bad Standard,"| Bad | The privacy policy does not satisfy several key criteria needed to meet a Good Standard Assessment. It lacks transparency about its legal basis for data processing. The purposes for data collection are not clearly defined or limited. The policy doesn't specify if it only collects necessary data. It also does not clarify if there are any measures ensuring data accuracy and whether the users can update or correct their data. Moreover, there's no discussion about storage limitation, no clear retention periods or criteria determining these periods, and no mentioning of the process for data deletion or anonymization. Lastly, there's no information regarding the security measures in place to protect data, such as encryption or security assessments."
34,magicplan,com.sensopia.magicplan,Productivity,5M+,https://magicplan.app/terms-conditions,Bad Standard,"| Bad | The document provided is a Terms of Service, not a Privacy Policy. It does not provide detailed information about data collection, usage, storage, and protection required to determine if it meets the Good Standard Assessment based on GDPR Article 5. There are mentions of a Privacy Policy, but the document itself does not provide any insight into how personal data is handled. Please provide the Privacy Policy document for proper assessment. |"
35,Floor Plan Creator,pl.planmieszkania.android,Art & DesignPlay Pass,10M+,https://floorplancreator.net/privacy,Good Standard,"| Good | This privacy policy is concise and transparent with clear information on data controllers and their contact details. It specifies the necessary minimum data needed for service operation, including personal and non-personal identifiable information. For data accuracy, the policy permits users to view, amend or delete their personal data. Data collected has a clear limited purpose, such as authentication and preventing abuse. The policy clearly states that emails will be stored until the user decides to delete their account, satisfying storage limitation and also non-personal data like server logs are deleted after a day, analytics cookies after 14 months. It ensures data integrity and confidentiality by storing data in a secure hosting location with strict access control and monitoring and using encrypted SSL for server communication."
36,Land id™,com.mapright.android,Productivity,100K+,https://id.land/legal/privacy-policy,Bad Standard,"| Bad | The policy does not mention the legal basis for data processing as outlined in GDPR Article 5's ""Lawfulness, Fairness, and Transparency"" mandate. While it states that Land id™ collects and uses personal data, it fails to clearly define the purposes for which this data is collected and used, violating the ""Purpose Limitation"" guideline. The ""Data Minimization"" principle is breached as the policy doesn't specify that only necessary data will be collected. The policy does not provide a clear process allowing users to correct their data, breaching the ""Accuracy"" guideline. It does not define clear retention periods for data or a process for data deletion, which is required by ""Storage Limitation"". Lastly, it doesn't explicitly mention any security measures in place to protect data, thereby violating the ""Integrity and Confidentiality"" principle of GDPR Article 5."
37,Landeed: Digital Property Docs,com.landeed,Tools,1M+,https://zj2530.wixsite.com/my-site-8/privacy-policy-for-landeed-android-app,Good Standard,"| Good | The Privacy Policy document meets the standard described in the Good Standard Assessment. The policy is clear and transparent in explaining their legal basis for the collection, usage, and disclosure of personal data. It discusses how the data is used and specifies the limited purposes for data collection (Purpose Limitation). They emphasize data minimization by stating that they only collect necessary data. They have also outlined measures for data accuracy by allowing users to update or correct their information (Accuracy). There are clear retention periods and processes for data deletion or anonymization after its purpose has been served (Storage Limitation). Finally, the policy describes measures taken to ensure the security and confidentiality of data. Thus, based on the GDPR Article 5 criteria, the policy is of Good standard."
38,RoomSketcher for Tablets,com.roomsketcher.homedesigner,House & Home,100K+,http://www.roomsketcher.com/privacy/,Good Standard,"| Good |
The Privacy Policy of the RoomSketcher App shows an adherence to the Good Standard Assessment, based on GDPR Article 5, for the following reasons:
- Lawfulness, Fairness, and Transparency: The policy clearly outlines that it collects both Personally Identifiable Information (PII) and Non-Personal Information (NPI) depending on user engagement with their services. The policy provides details of how PII is collected and used, thus providing transparency.
- Purpose Limitation: The policy clearly mentions the purposes for which the data is collected which range from maintaining user accounts to responding to inquiries and ensuring system security. It also mentions that personal data is not used for marketing purposes without consent.
- Data Minimization: The types of data collected are outlined clearly and appear necessary for the delivery of their services. Detailed information is only collected from users when necessary, such as during registration.
- Accuracy: Users are provided options to update, change, or delete their personal information, indicating that the company ensures data accuracy.
- Storage Limitation: Although the policy does not explicitly state the time limit for which the data will be kept, it does discuss providing users control over their personal information, suggesting they practice data storage limitation.
- Integrity and Confidentiality: The policy indicates that RoomSketcher maintains physical, electronic, and procedural safeguards to help guard personally identifiable information and uses industry-standard encryption techniques during transactions to ensure data security.
Therefore, this privacy policy upholds the Good Standard based on the guidelines of the GDPR."
39,"Planner 5D: Home Design, Decor",com.planner5d.planner5d,House & Home,10M+,https://planner5d.com/pages/privacy/,Good Standard,"| Good | The privacy policy of Planner 5D is classified as Good Standard for several reasons based on our assessment criteria:
Lawfulness, Fairness, and Transparency: The document clearly mentions its legal position and the basis of its data processing. It is clear about its actions, and the language is simple, making it easy for users to understand.
Purpose Limitation: The company specified several purposes for collecting and using personal information. It ensures that data won't be used for incompatible purposes without additional consent.
Data Minimization: The document outlines that they only collect necessary data, such as name, email, and photo for account creation.
Accuracy: The policy provides ways for users to update or correct their data. It maintains rights for data correction and completion.
Storage Limitation: The policy clarifies that data is retained for as long the user is registered. However, it also mentions that they will comply with legal, accounting, and regulatory requirements.
Integrity and Confidentiality: The document outlines the security measures (organizational and technical) taken to protect data. They only provide access to authorized personnel and consultants while adhering to relevant legislation.
It also clearly outlines users' data privacy rights, shares information about their cookie policy, and respects children's privacy, explicitly stating that they don't knowingly collect children's data. They also explicitly mention third-party links, updates to their policy, data sharing regulations with third parties as well as subprocessors used and their service location."
40,Maple - Household Planner,com.growmaple.android,Parenting,10K+,https://www.growmaple.com/privacy,Good Standard,"| Good | The privacy policy of the application clearly states its legal basis for data processing and is transparent about how user data is used to enhance service delivery. It describes in detail the personal information it collects based on user interaction, and how it obtains, uses, and discloses that information, thus showing purpose limitation and data minimization. The policy includes a means for users to request and receive information about the data collected in the past 12 months, fulfilling the accuracy requirement. It does mention security measures, stating that despite not being able to guarantee 100% security, they've taken commercially reasonable safeguards to protect user data, demonstrating an essence of integrity and confidentiality. The policy, however, does not clearly define retention periods, but mentions that data will be kept for as long as necessary to fulfill its intended purposes. Despite this, the policy overall adheres to most criteria making it a Good Standard."
41,Airbnb,com.airbnb.android,Travel & Local,100M+,https://www.airbnb.com/help/article/2855/,Bad Standard,"| Bad | The document provided does not discuss any of the key points required for a Good Standard Assessment. There is no mention of lawfulness, fairness, transparency, purpose limitation, data minimization, accuracy, storage limitation, or integrity and confidentiality. It seems to be only an instruction on how to use a search function, not a privacy policy."
42,Guru Maps — GPS Route Planner,com.bodunov.galileo,Travel & Local,1M+,https://gurumaps.app/privacy_policy/,Good Standard,"| Good | The reason is based on the given definitions for Good Standard Assessment. The privacy policy of Guru Maps corresponds well with the GDPR Article 5. It clearly states the legal basis for data processing by indicating that everything is done with the user's consent, for legitimate business interests, for fulfillment of a contract, or by legal obligations (Lawfulness, Fairness, and Transparency). It limits the purpose of data collection to maintaining the security and operation of the app and for internal analytics and reporting (Purpose Limitation). It collects only the necessary information for the working of the app and any additional data only with the user's consent (Data Minimization). It provides mechanisms for users to review, update, and delete their information, ensuring data accuracy. It also defines a clear retention period of less than 1 year for data and outlines the data deletion and anonymization process (Storage Limitation). It also takes efforts to maintain data integrity and confidentiality by implementing appropriate security measures and informing users about risks of data transmission."
43,Map Tv Viewer,com.smart.television.mapviewer,Maps & Navigation,5K+,https://techshunya.com/apps/mapviewtv/privacy_policy.html,Bad Standard,"| Bad Standard | The privacy policy, although quite elaborate, falls short of the Good Standard GDPR Article 5 requirements in several ways. Firstly, the language used, while not overly complex, lacks transparency on the specific legal basis for data processing. Secondly, the policy does not clearly limit the purposes for data collection as it vaguely states that the data is used to provide and improve the service, making the policy open to broad interpretations. Thirdly, the policy does not highlight a commitment to data minimization and does not inform users about limiting data collection to only what is necessary. Fourthly, no explicit measures for ensuring data accuracy or mechanisms for users to update or correct their data are stated. In addition, while the policy asserts they use ""commercially acceptable means of protecting"" personal information, it does not detail specific security measures like encryption or regular security assessments. Lastly, there is no mention of specific data retention periods or criteria for determining these periods, nor a process for data deletion or anonymization."
44,All-In-One Offline Maps,net.psyberia.offlinemaps,Maps & Navigation,5M+,http://www.offline-maps.net/en/privacy,Good Standard,"| Good |
The policy is transparent and descriptive about the collection, use, and disclosure of Personal Information (Requirement of Lawfulness, Fairness, and Transparency). It details the types of information collected and the reasons for this (Requirement of Purpose Limitation). By aiming to only capture necessary data for specific functions, it fulfills the Data Minimization standard. Additionally, it provides mechanisms for consumers to access, update, and delete their personal information, aligning with the Accuracy and Storage Limitation requirements. While no security can be 100% foolproof, the document outlines its commitment to data security and regulatory compliance (Integrity and Confidentiality). However, it does not specifically mention practices like encryption or regular security assessments. Therefore, although it could expand on its data security methods further, the overall policy appears to meet the Good Standard criteria."
